sentence_id_ai,speech_id,electoral_term,session,party,first_name,last_name,date,topic,combined_text,combined_text_preprocessed,tech_sentiment,guhr_sentiment
2865808,1077988,20,57,SPD,parsa,marvi,2022-09-29,Policy,"Das wird Vertrauen stärken, das wird die Akzeptanz in KI stärken und zu einer größeren Nutzung in Europa führen. Wir verbinden mit den Verhandlungen zur KI‑Verordnung zum Beispiel die Hoffnung, dass man sich einigt auf den Ausschluss der biometrischen Fernidentifizierung in Echtzeit im öffentlichen Raum im Rahmen staatlicher und privater Anwendungen.",vertrauen stärken akzeptanz ki stärken größeren nutzung europa führen verbinden verhandlungen ki‑verordnung beispiel hoffnung einigt ausschluss biometrischen fernidentifizierung echtzeit öffentlichen raum rahmen staatlicher privater anwendungen,neutral,neutral
2865813,1077988,20,57,SPD,parsa,marvi,2022-09-29,Policy,Wir wollen bei diesen anstehenden Verhandlungen die Grundrechte im Rahmen der KI-Verordnung stärken. Wir wollen eine Kennzeichnungs- und Transparenzpflicht für KI.,anstehenden verhandlungen grundrechte rahmen kiverordnung stärken kennzeichnungs transparenzpflicht ki,negative,neutral
2865822,1077990,20,57,AfD,joana,cotar,2022-09-29,Policy,"Die EU macht wieder einmal das, was sie am besten kann: Sie reguliert sich zu Tode. Diesmal geht es um das Thema künstliche Intelligenz.",eu macht besten reguliert tode diesmal geht thema künstliche intelligenz,neutral,neutral
2865825,1077990,20,57,AfD,joana,cotar,2022-09-29,Economy,"Man will die großen Konzerne treffen und verliert dabei die kleinen und mittleren Unternehmen aus den Augen, die den Murks dann ausbaden dürfen. KI wird von der Europäischen Union zuallererst als bedenklich, gefährlich, risikobehaftet angesehen.",großen konzerne treffen verliert kleinen mittleren unternehmen augen murks ausbaden dürfen ki europäischen union zuallererst bedenklich gefährlich risikobehaftet angesehen,negative,neutral
2865828,1077990,20,57,AfD,joana,cotar,2022-09-29,Policy,"Während andere Länder und Unternehmen vor allem die Vorteile sehen, die Chancen, die sich bieten, konzentriert sich die EU auf das Negative und will, wenn möglich, alles bis ins kleinste Detail regeln. Bei der Expertenanhörung, die wir am Montag dazu hatten, wurde recht deutlich, dass dieses Vorgehen den KI-Standort Europa gefährden kann, oder wie es ein Experte sehr drastisch formulierte: Die geplante Verordnung hat das Potenzial, KI in Europa gänzlich unmöglich zu machen.",länder unternehmen vorteile sehen chancen bieten konzentriert eu negative möglich kleinste detail regeln expertenanhörung montag wurde recht deutlich vorgehen kistandort europa gefährden experte drastisch formulierte geplante verordnung potenzial ki europa gänzlich unmöglich,negative,negative
2865832,1077990,20,57,AfD,joana,cotar,2022-09-29,Policy,"Das können wir uns gerade aktuell, in einer Zeit wie dieser, in einer Zeit, in der Europa vielmehr unabhängiger, souveräner werden muss, nicht erlauben, meine Damen und Herren. Ginge es nach der EU, wäre im Prinzip jeder Taschenrechner eine künstliche Intelligenz.",aktuell zeit zeit europa vielmehr unabhängiger souveräner erlauben ginge eu wäre prinzip taschenrechner künstliche intelligenz,neutral,neutral
2865836,1077990,20,57,AfD,joana,cotar,2022-09-29,Economy,"So verliert der Standort Deutschland schlichtweg seine Wettbewerbsfähigkeit. Die Bundesregierung muss unserer Meinung nach also darauf hinwirken, dass neben den Risiken vor allem die Chancen von KI‑Lösungen betont werden.",verliert standort deutschland schlichtweg wettbewerbsfähigkeit bundesregierung unserer meinung hinwirken neben risiken chancen ki‑lösungen betont,positive,neutral
2865837,1077990,20,57,AfD,joana,cotar,2022-09-29,Policy,"Die Bundesregierung muss unserer Meinung nach also darauf hinwirken, dass neben den Risiken vor allem die Chancen von KI‑Lösungen betont werden. Eine defensive Regulierung von KI‑Lösungen bringt nicht nur für Start-ups und KMUs ein immenses Quantum an Bürokratie, sie führt auch dazu, dass Innovationen im Bereich KI sich in anderen Regionen der Welt vollziehen.",bundesregierung unserer meinung hinwirken neben risiken chancen ki‑lösungen betont defensive regulierung ki‑lösungen bringt startups kmus immenses quantum bürokratie führt innovationen bereich ki regionen welt vollziehen,neutral,neutral
2865838,1077990,20,57,AfD,joana,cotar,2022-09-29,Policy,"Eine defensive Regulierung von KI‑Lösungen bringt nicht nur für Start-ups und KMUs ein immenses Quantum an Bürokratie, sie führt auch dazu, dass Innovationen im Bereich KI sich in anderen Regionen der Welt vollziehen. Man könnte zum Beispiel die KI‑Verordnung um eine Chancen- und Wertigkeitsklasse von KI‑Lösungen erweitern, wie wir das in unserem vorgelegten Antrag fordern.",defensive regulierung ki‑lösungen bringt startups kmus immenses quantum bürokratie führt innovationen bereich ki regionen welt vollziehen beispiel ki‑verordnung chancen wertigkeitsklasse ki‑lösungen erweitern vorgelegten fordern,neutral,neutral
2865839,1077990,20,57,AfD,joana,cotar,2022-09-29,Policy,"Man könnte zum Beispiel die KI‑Verordnung um eine Chancen- und Wertigkeitsklasse von KI‑Lösungen erweitern, wie wir das in unserem vorgelegten Antrag fordern. Die prohibitiv wirkenden administrativen und finanziellen Hürden zur KI-Risikoklassifizierung müssen gesenkt werden, damit auch Start-ups und KMUs eine solche Einschätzung ihrer KI‑Lösungen vornehmen können und diese in den Verkehr bringen können.",beispiel ki‑verordnung chancen wertigkeitsklasse ki‑lösungen erweitern vorgelegten fordern prohibitiv wirkenden administrativen finanziellen hürden kirisikoklassifizierung müssen gesenkt startups kmus einschätzung ki‑lösungen vornehmen verkehr bringen,neutral,neutral
2865844,1077990,20,57,AfD,joana,cotar,2022-09-29,Security,"Der Einsatz von KI zu Strafverfolgungs- und Gefahrenabwehrzwecken gehört nicht in die Regelungskompetenz der EU. Eine Verschärfung des Einsatzes von KI durch die mitgliedstaatlichen Sicherheitsbehörden darf es daher durch diese Verordnung nicht geben, meine Damen und Herren.",einsatz ki strafverfolgungs gefahrenabwehrzwecken gehört regelungskompetenz eu verschärfung einsatzes ki mitgliedstaatlichen sicherheitsbehörden darf verordnung geben,neutral,neutral
2865849,1077990,20,57,AfD,joana,cotar,2022-09-29,Policy,"In der Anhörung wurde von einem Sachverständigen etwas gesagt, was wir hier im Bundestag leider viel zu wenig hören. Auf den Hinweis der EU, dass es notwendig sei, KI auf EU‑Ebene zu regulieren, weil es sonst bald 27 nationale KI‑Verordnungen geben würde, antwortete der Experte: Gut so, dann gibt es endlich Wettbewerb.",anhörung wurde sachverständigen gesagt bundestag wenig hören hinweis eu notwendig sei ki eu‑ebene regulieren bald nationale ki‑verordnungen geben antwortete experte gibt endlich wettbewerb,neutral,neutral
2865860,1077994,20,57,Grüne,anna,christmann,2022-09-29,Policy,"Liebe Kolleginnen und Kollegen! Es ist gut, dass wir heute über „Künstliche Intelligenz made in Europe“ sprechen; denn wir reden hier darüber, dass in Europa Standards für eine Zukunftstechnologie definiert werden.",kolleginnen kollegen heute „künstliche intelligenz made europe“ sprechen reden darüber europa standards zukunftstechnologie definiert,positive,neutral
2865866,1077994,20,57,Grüne,anna,christmann,2022-09-29,Policy,"Diese Bundesregierung hat bereits dreimal eine Stellungnahme – geeint zwischen allen Ressorts – eingebracht gegenüber der EU-Kommission, der Ratspräsidentschaft. Wir bringen uns sehr aktiv ein in diese Verordnung, weil wir um ihre große Bedeutung wissen und weil sie der Schlüssel ist für einen starken Standort für künstliche Intelligenz in Europa.",bundesregierung bereits dreimal stellungnahme – geeint ressorts – eingebracht gegenüber eukommission ratspräsidentschaft bringen aktiv verordnung große bedeutung wissen schlüssel starken standort künstliche intelligenz europa,neutral,neutral
2865870,1077994,20,57,Grüne,anna,christmann,2022-09-29,Science,"Deswegen ist es richtig, dass sich gerade die Definition weiterentwickelt. Mit dem aktuellsten Vorschlag werden nicht mehr sämtliche statistischen Systeme erfasst; es geht um maschinelles Lernen und um Expertensysteme, aber nicht mehr um jedes Programm, das in irgendeiner Form eine Rechnung durchführt.",richtig definition weiterentwickelt aktuellsten vorschlag mehr sämtliche statistischen systeme erfasst geht maschinelles lernen expertensysteme mehr programm irgendeiner form rechnung durchführt,neutral,neutral
2865889,1077994,20,57,Grüne,anna,christmann,2022-09-29,Society,"Natürlich ist es richtig, dass diese Standards für verschiedene Anwendungen im Gesundheitsbereich gelten müssen. Natürlich ist es richtig, dass sie zum Beispiel für den Zugang zu Wohnungen gelten müssen, wenn so was mit KI gemacht wird.",richtig standards verschiedene anwendungen gesundheitsbereich gelten müssen richtig beispiel zugang wohnungen gelten müssen ki gemacht,neutral,neutral
2865892,1077994,20,57,Grüne,anna,christmann,2022-09-29,Society,"Da muss man draufschauen. KI muss natürlich fair, nachvollziehbar, transparent sein.",draufschauen ki fair nachvollziehbar transparent,negative,negative
2865897,1077994,20,57,Grüne,anna,christmann,2022-09-29,Economy,"In der Digitalstrategie haben wir ein Programm für Unternehmen aufgelegt: Kickstart. Wir verbessern die Datenverfügbarkeit, die zentral ist für die Anwendungen von KI.",digitalstrategie programm unternehmen aufgelegt kickstart verbessern datenverfügbarkeit zentral anwendungen ki,neutral,neutral
2865898,1077994,20,57,Grüne,anna,christmann,2022-09-29,Policy,"Wir verbessern die Datenverfügbarkeit, die zentral ist für die Anwendungen von KI. Das heißt, wir haben beides auf dem Schirm: eine kluge Regulierung, aber auch die nötige Unterstützung für Innovationen im Bereich KI.",verbessern datenverfügbarkeit zentral anwendungen ki heißt beides schirm kluge regulierung nötige unterstützung innovationen bereich ki,neutral,neutral
2865899,1077994,20,57,Grüne,anna,christmann,2022-09-29,Policy,"Das heißt, wir haben beides auf dem Schirm: eine kluge Regulierung, aber auch die nötige Unterstützung für Innovationen im Bereich KI. Und daraus wird eine gute künstliche Intelligenz made in Europe werden.",heißt beides schirm kluge regulierung nötige unterstützung innovationen bereich ki daraus gute künstliche intelligenz made europe,positive,neutral
2865902,1077996,20,57,Linke,petra,sitte,2022-09-29,Economy,Meine Damen und Herren! Künstliche Intelligenz ist keine Zukunftstechnologie mehr.,,negative,neutral
2865904,1077996,20,57,Linke,petra,sitte,2022-09-29,Policy,"Längst begegnet sie uns täglich, und die meisten rechnen noch nicht einmal damit. Vor allem wissen sie nicht, dass der Einsatz und die Nutzung der KI im Moment nahezu im rechtsfreien Raum stattfinden.",längst begegnet täglich meisten rechnen wissen einsatz nutzung ki moment nahezu rechtsfreien raum stattfinden,negative,neutral
2865912,1077996,20,57,Linke,petra,sitte,2022-09-29,Society,Was ist gemeint? Da ist erstens die Definition – Frau Christmann hat es gerade erwähnt –: Was wird unter KI oder – besser – unter maschinellem Lernen verstanden?,gemeint erstens definition – christmann erwähnt – ki – besser – maschinellem lernen verstanden,neutral,neutral
2865920,1077996,20,57,Linke,petra,sitte,2022-09-29,Policy,"Wir finden, das ist eine wichtige vertrauensbildende Maßnahme. Zweitens will die Bundesregierung die KI‑Nutzung in Sicherheitsbehörden gesondert regeln.",finden wichtige vertrauensbildende maßnahme zweitens bundesregierung ki‑nutzung sicherheitsbehörden gesondert regeln,neutral,neutral
2865941,1078000,20,57,FDP,maximilian,funke-kaiser,2022-09-29,Policy,"Das zeigen wir auch mit der notwendigen Debatte über die Förderung von künstlicher Intelligenz in Europa, in Deutschland, und das nicht erst seit dieser Woche, sondern bereits seit vielen Monaten. Für die FDP-Fraktion waren, sind und bleiben für die Auslegung einer EU‑Rechtsverordnung für künstliche Intelligenz zwei Prämissen ganz essenziell.",zeigen notwendigen debatte förderung künstlicher intelligenz europa deutschland seit woche bereits seit vielen monaten fdpfraktion bleiben auslegung eu‑rechtsverordnung künstliche intelligenz zwei prämissen ganz essenziell,neutral,neutral
2865946,1078000,20,57,FDP,maximilian,funke-kaiser,2022-09-29,Policy,"Da machen wir auch Druck. Wir dürfen nicht Gefahr laufen, dass wir uns mit der KI‑Verordnung einen neuen Klotz ans Bein binden.",druck dürfen gefahr laufen ki‑verordnung neuen klotz ans bein binden,neutral,neutral
2865948,1078000,20,57,FDP,maximilian,funke-kaiser,2022-09-29,Policy,"Natürlich müssen wir uns darüber im Klaren sein, dass wir in dieser Schlüsseltechnologie auch besser sein könnten. Deswegen wird es jetzt auch eine KI‑Verordnung geben, einmalig im globalen Kontext.",müssen darüber klaren schlüsseltechnologie besser könnten ki‑verordnung geben einmalig globalen kontext,neutral,neutral
2865951,1078000,20,57,FDP,maximilian,funke-kaiser,2022-09-29,Policy,"Wir machen Druck, weil wir es besser können und weil wir besser werden müssen. Das werden wir mit der KI‑Verordnung.",druck besser besser müssen ki‑verordnung,neutral,negative
2865954,1078000,20,57,FDP,maximilian,funke-kaiser,2022-09-29,Policy,"Wir machen Druck, dass wir keinen Verhinderungswahn erleben. Wir machen Druck, dass wir klare Regeln in dieser KI‑Verordnung bekommen, damit sich diese Schlüsseltechnologie in Europa entfalten kann, liebe Kolleginnen und Kollegen!",druck verhinderungswahn erleben druck klare regeln ki‑verordnung bekommen schlüsseltechnologie europa entfalten kolleginnen kollegen,neutral,neutral
2865969,1078002,20,57,CDU/CSU,catarina,dos santos-wintz,2022-09-29,Economy,"Liebe Kolleginnen und Kollegen! Künstliche Intelligenz ist die treibende Kraft in der Entwicklung der Digitalisierung, und daher müssen wir uns klar darüber sein, welch hohe Bedeutung die Regulierung in diesem Bereich hat.",kolleginnen kollegen künstliche intelligenz treibende kraft entwicklung digitalisierung müssen darüber welch hohe bedeutung regulierung bereich,positive,neutral
2865976,1078002,20,57,CDU/CSU,catarina,dos santos-wintz,2022-09-29,Policy,"Doch ich will mich an dieser Stelle auf wesentliche inhaltliche Punkte konzentrieren. Wir brauchen meines Erachtens – erstens – eine starke Definition des Begriffs „künstliche Intelligenz“, zweitens eine europäische Souveränität im Bereich Entwicklung und Nutzung von KI, und wir brauchen – drittens – jetzt die richtigen Entscheidungen für einen zukunftsfähigen Wohlstand, den uns diese Technologie bringen wird.",stelle wesentliche inhaltliche punkte konzentrieren brauchen erachtens – erstens – starke definition begriffs „künstliche intelligenz“ zweitens europäische souveränität bereich entwicklung nutzung ki brauchen – drittens – richtigen entscheidungen zukunftsfähigen wohlstand technologie bringen,neutral,neutral
2865977,1078002,20,57,CDU/CSU,catarina,dos santos-wintz,2022-09-29,Science,"Wir brauchen meines Erachtens – erstens – eine starke Definition des Begriffs „künstliche Intelligenz“, zweitens eine europäische Souveränität im Bereich Entwicklung und Nutzung von KI, und wir brauchen – drittens – jetzt die richtigen Entscheidungen für einen zukunftsfähigen Wohlstand, den uns diese Technologie bringen wird. Die Definition des Begriffs „künstliche Intelligenz“ ist aus unserer Sicht in der europäischen Verordnung zu allgemein gefasst.",brauchen erachtens – erstens – starke definition begriffs „künstliche intelligenz“ zweitens europäische souveränität bereich entwicklung nutzung ki brauchen – drittens – richtigen entscheidungen zukunftsfähigen wohlstand technologie bringen definition begriffs „künstliche intelligenz“ unserer sicht europäischen verordnung allgemein gefasst,neutral,neutral
2865985,1078002,20,57,CDU/CSU,catarina,dos santos-wintz,2022-09-29,Science,Klar ist auch: Wir werden die Gesetzgebung regelmäßig an die Gegenwart anpassen müssen. Aber in einem Punkt sollten wir uns alle einig sein: Europa sollte im Feld „künstliche Intelligenz“ die Spitzenposition im Bereich Forschung und Entwicklung belegen.,gesetzgebung regelmäßig gegenwart anpassen müssen punkt sollten europa feld „künstliche intelligenz“ spitzenposition bereich forschung entwicklung belegen,positive,neutral
2865988,1078002,20,57,CDU/CSU,catarina,dos santos-wintz,2022-09-29,Economy,"Die Entwicklung schreitet rasant voran, und wir sind durchaus gut aufgestellt. Es werden beispielsweise in Aachen Sprachsteuerungsmodelle entwickelt, oder Mittelständler finden mithilfe von KI heraus, wann bei einem Windrad Einzelteile getauscht werden müssen, ohne dass jemand auf ein Windrad klettern muss.",entwicklung schreitet rasant voran durchaus aufgestellt beispielsweise aachen sprachsteuerungsmodelle entwickelt mittelständler finden mithilfe ki heraus wann windrad einzelteile getauscht müssen jemand windrad klettern,positive,neutral
2866011,1078004,20,57,SPD,armand,zorn,2022-09-29,Economy,"Sehr geehrte Damen und Herren! Die Zukunftstechnologie „künstliche Intelligenz“ hat das Potenzial, unsere Wirtschaft, unsere Arbeitswelt und auch unseren Alltag grundlegend zu verändern.",geehrte zukunftstechnologie „künstliche intelligenz“ potenzial wirtschaft arbeitswelt alltag grundlegend verändern,neutral,neutral
2866014,1078004,20,57,SPD,armand,zorn,2022-09-29,Economy,"Beispielsweise werden in der Produktion Prozesse KI-gesteuert energieeffizienter aufgestellt, oder KI-basierte Assistenztechnologien erleichtern Menschen mit Schwerbehinderung eine Teilhabe am Arbeitsplatz. Die Bedeutung von KI wird in Zukunft noch zentraler werden.",beispielsweise produktion prozesse kigesteuert energieeffizienter aufgestellt kibasierte assistenztechnologien erleichtern menschen schwerbehinderung teilhabe arbeitsplatz bedeutung ki zukunft zentraler,positive,neutral
2866015,1078004,20,57,SPD,armand,zorn,2022-09-29,Economy,"Die Bedeutung von KI wird in Zukunft noch zentraler werden. Eine McKinsey-Studie schätzt, dass das globale Wirtschaftswachstum durch KI bis 2030 um bis zu 13 Billionen US-Dollar ansteigen wird.",bedeutung ki zukunft zentraler mckinseystudie schätzt globale wirtschaftswachstum ki billionen usdollar ansteigen,positive,neutral
2866016,1078004,20,57,SPD,armand,zorn,2022-09-29,Economy,"Eine McKinsey-Studie schätzt, dass das globale Wirtschaftswachstum durch KI bis 2030 um bis zu 13 Billionen US-Dollar ansteigen wird. Damit wird KI für die zukünftige Wettbewerbsfähigkeit Deutschlands und Europas entscheidend sein.",mckinseystudie schätzt globale wirtschaftswachstum ki billionen usdollar ansteigen ki zukünftige wettbewerbsfähigkeit deutschlands europas entscheidend,positive,neutral
2866030,1078004,20,57,SPD,armand,zorn,2022-09-29,Society,"Der AI‑Act wird diese Akzeptanz schaffen, indem er explizit auch auf die Risiken im Hinblick auf die Nutzung eingeht. Entscheidungen, die durch KI‑Systeme vorbereitet und getroffen werden, können tiefgreifende Auswirkungen auf das Leben von Bürgerinnen und Bürgern haben.",ai‑act akzeptanz schaffen explizit risiken hinblick nutzung eingeht entscheidungen ki‑systeme vorbereitet getroffen tiefgreifende auswirkungen leben bürgerinnen bürgern,neutral,neutral
2866033,1078004,20,57,SPD,armand,zorn,2022-09-29,Policy,Wir brauchen hier endlich eine Regulierung. Künstliche Intelligenz hält vermehrt Einzug in das alltägliche Leben.,brauchen endlich regulierung künstliche intelligenz hält vermehrt einzug alltägliche leben,neutral,neutral
2866034,1078004,20,57,SPD,armand,zorn,2022-09-29,Economy,Künstliche Intelligenz hält vermehrt Einzug in das alltägliche Leben. Zum Beispiel unterstützen KI‑basierte Systeme die Auswahl von passenden Bewerberinnen und Bewerbern.,künstliche intelligenz hält vermehrt einzug alltägliche leben beispiel unterstützen ki‑basierte systeme auswahl passenden bewerberinnen bewerbern,neutral,neutral
2866035,1078004,20,57,SPD,armand,zorn,2022-09-29,Society,"Zum Beispiel unterstützen KI‑basierte Systeme die Auswahl von passenden Bewerberinnen und Bewerbern. Auch wenn es darum geht, Leistungsbewertungen von Beschäftigten auszuwerten, werden zunehmend KI‑basierte Systeme genutzt.",beispiel unterstützen ki‑basierte systeme auswahl passenden bewerberinnen bewerbern geht leistungsbewertungen beschäftigten auszuwerten zunehmend ki‑basierte systeme genutzt,neutral,neutral
2866036,1078004,20,57,SPD,armand,zorn,2022-09-29,Society,"Auch wenn es darum geht, Leistungsbewertungen von Beschäftigten auszuwerten, werden zunehmend KI‑basierte Systeme genutzt. Auch bei der Vergabe von Krediten und dem Abschluss von Versicherungen sind KI‑gestützte Systeme bereits im Einsatz.",geht leistungsbewertungen beschäftigten auszuwerten zunehmend ki‑basierte systeme genutzt vergabe krediten abschluss versicherungen ki‑gestützte systeme bereits einsatz,neutral,neutral
2866038,1078004,20,57,SPD,armand,zorn,2022-09-29,Society,"Das heißt also: Hier besteht ein hohes Diskriminierungsrisiko. KI‑Systeme basieren auf Trainingsdaten, die auch diskriminierende Muster enthalten können.",heißt besteht hohes diskriminierungsrisiko ki‑systeme basieren trainingsdaten diskriminierende muster enthalten,negative,neutral
2866039,1078004,20,57,SPD,armand,zorn,2022-09-29,Policy,"KI‑Systeme basieren auf Trainingsdaten, die auch diskriminierende Muster enthalten können. Daher brauchen wir Regeln, um diese Ungleichbehandlung, die tatsächlich stattfindet, zu reduzieren und somit auch das Vertrauen in künstliche Intelligenz zu erhöhen.",ki‑systeme basieren trainingsdaten diskriminierende muster enthalten brauchen regeln ungleichbehandlung tatsächlich stattfindet reduzieren somit vertrauen künstliche intelligenz erhöhen,negative,neutral
2866040,1078004,20,57,SPD,armand,zorn,2022-09-29,Policy,"Daher brauchen wir Regeln, um diese Ungleichbehandlung, die tatsächlich stattfindet, zu reduzieren und somit auch das Vertrauen in künstliche Intelligenz zu erhöhen. Ein erster Schritt kann eine Informationspflicht sein, damit Verbraucherinnen und Verbraucher tatsächlich darüber informiert werden, wenn sie mit KI interagieren.",brauchen regeln ungleichbehandlung tatsächlich stattfindet reduzieren somit vertrauen künstliche intelligenz erhöhen erster schritt informationspflicht verbraucherinnen verbraucher tatsächlich darüber informiert ki interagieren,neutral,neutral
2866055,1078006,20,57,Grüne,sabine,grützmacher,2022-09-29,Society,"Wenn das die vertrauensbildenden Maßnahmen sind, die Sie sich vorstellen, dann sehe ich da tatsächlich schwarz. Ich glaube, im Kern sind wir uns einig: KI soll den Nutzen für die Gesellschaft in den Mittelpunkt stellen.",vertrauensbildenden maßnahmen vorstellen sehe tatsächlich schwarz glaube kern ki nutzen gesellschaft mittelpunkt stellen,neutral,neutral
2866059,1078006,20,57,Grüne,sabine,grützmacher,2022-09-29,Policy,"In der Anhörung zum AI‑Act machte der Sachverständige Herr Geuter deutlich: Zu oft wird über Vorstellungen und Fantasien der Zukunft geredet, die nicht auf wirklichen Eigenschaften oder Strukturen basieren. Aber KI liefert nicht auf magische Weise automatisch Mehrwert.",anhörung ai‑act machte sachverständige geuter deutlich oft vorstellungen fantasien zukunft geredet wirklichen eigenschaften strukturen basieren ki liefert magische weise automatisch mehrwert,negative,neutral
2866060,1078006,20,57,Grüne,sabine,grützmacher,2022-09-29,Society,Aber KI liefert nicht auf magische Weise automatisch Mehrwert. Das zeigt Ihr Beispiel zum angeblich erfolgreichen KI‑Einsatz in der Pandemie.,ki liefert magische weise automatisch mehrwert zeigt beispiel angeblich erfolgreichen ki‑einsatz pandemie,negative,negative
2866062,1078006,20,57,Grüne,sabine,grützmacher,2022-09-29,Economy,Es gibt eine Metastudie des MIT. Es fand unter über 100 Anwendungen keine einzige erfolgreiche KI‑Anwendung.,gibt metastudie fand anwendungen einzige erfolgreiche ki‑anwendung,negative,neutral
2866063,1078006,20,57,Grüne,sabine,grützmacher,2022-09-29,Economy,"Es fand unter über 100 Anwendungen keine einzige erfolgreiche KI‑Anwendung. Aber ich verstehe trotzdem den Punkt; denn ja, gute KI kann Innovation hervorbringen.",fand anwendungen einzige erfolgreiche ki‑anwendung verstehe trotzdem punkt gute ki innovation hervorbringen,neutral,neutral
2866064,1078006,20,57,Grüne,sabine,grützmacher,2022-09-29,Economy,"Aber ich verstehe trotzdem den Punkt; denn ja, gute KI kann Innovation hervorbringen. Wir müssen aber anfangen, zwischen Algorithmen, künstlicher Intelligenz, Machine Learning, Deep Learning und zukünftigen Ansätzen wie Quantum Machine Learning zu unterscheiden und auch diese Entwicklung zu ermöglichen.",verstehe trotzdem punkt gute ki innovation hervorbringen müssen anfangen algorithmen künstlicher intelligenz machine learning deep learning zukünftigen ansätzen quantum machine learning unterscheiden entwicklung ermöglichen,neutral,neutral
2866066,1078006,20,57,Grüne,sabine,grützmacher,2022-09-29,Economy,"Wir müssen uns da auch ehrlich machen; denn Zukunftstechnologien machen nicht per se alles besser, weil Buzzwords auf dem Etikett stehen. Sie machen es besser, wenn echte KI‑Anwendungen enthalten sind und passende Technologien für passende Szenarien ausgewählt werden.",müssen ehrlich zukunftstechnologien per se besser buzzwords etikett stehen besser echte ki‑anwendungen enthalten passende technologien passende szenarien ausgewählt,negative,negative
