sentence_id_ai,speech_id,electoral_term,session,party,first_name,last_name,date,topic,combined_text,combined_text_preprocessed,tech_sentiment,guhr_sentiment
3141303,1099767,20,125,AfD,barbara,benkstein,2023-09-28,Economy,"Ja, Ihre Forderung nach einem eigenen Zugang für KMU, Start-ups und Open-Source-Entwickler ist demnach folgerichtig. Die Initiative LEAM, die Anfang des Jahres 2023 vom KI Bundesverband präsentiert wurde, setzt auf eine gesonderte KI-Infrastruktur und beziffert deren mutmaßliche Kosten auf rund 300 Millionen Euro.",forderung eigenen zugang kmu startups opensourceentwickler demnach folgerichtig initiative leam anfang jahres ki bundesverband präsentiert wurde setzt gesonderte kiinfrastruktur beziffert deren mutmaßliche kosten rund millionen euro,neutral,neutral
3141308,1099767,20,125,AfD,barbara,benkstein,2023-09-28,Policy,"Sie, werte Kollegen der Union, sprechen in Ihrem Antrag vorsichtig davon, die Bundesregierung möge im Rahmen der verfügbaren Haushaltsmittel die Voraussetzungen für geeignete Rechenkapazitäten schaffen. Angesichts der Bedeutung der Thematik der KI ist es doch nur konsequent, im Etat auch dementsprechend Mittel zur Verfügung zu stellen.",werte kollegen union sprechen vorsichtig davon bundesregierung möge rahmen verfügbaren haushaltsmittel voraussetzungen geeignete rechenkapazitäten schaffen angesichts bedeutung thematik ki konsequent etat dementsprechend mittel verfügung stellen,neutral,neutral
3141320,1099769,20,125,Grüne,omid,nouripour,2023-09-28,Society,"Meine Damen und Herren! Netflix schlägt uns neue Lieblingsserien vor, Google kuratiert unsere Suchen, für viele ist künstliche Intelligenz allgegenwärtig.",,neutral,neutral
3141323,1099769,20,125,Grüne,omid,nouripour,2023-09-28,Science,"Die Potenziale, jenseits dieser Rede, sind gewaltig. Die Wissenschaft macht große Sprünge; das sieht man gerade auch in der medizinischen Forschung, wenn KI sinnvoll zum Einsatz kommt.",potenziale jenseits gewaltig wissenschaft macht große sprünge sieht medizinischen forschung ki sinnvoll einsatz kommt,positive,negative
3141324,1099769,20,125,Grüne,omid,nouripour,2023-09-28,Science,"Die Wissenschaft macht große Sprünge; das sieht man gerade auch in der medizinischen Forschung, wenn KI sinnvoll zum Einsatz kommt. Die Dekarbonisierung der Industrie wird massiv davon profitieren, wenn künstliche Intelligenz eingesetzt wird.",wissenschaft macht große sprünge sieht medizinischen forschung ki sinnvoll einsatz kommt dekarbonisierung industrie massiv davon profitieren künstliche intelligenz eingesetzt,positive,neutral
3141326,1099769,20,125,Grüne,omid,nouripour,2023-09-28,Economy,Die Potenziale für die Wirtschaft sind gewaltig; Sie haben gerade die Studie erwähnt. Allein die richtige Anwendung von generativer KI kann 330 Milliarden Euro Wertschöpfung in unserer Volkswirtschaft bzw. als Profite für die Unternehmen bringen.,potenziale wirtschaft gewaltig studie erwähnt allein richtige anwendung generativer ki milliarden euro wertschöpfung unserer volkswirtschaft bzw profite unternehmen bringen,positive,neutral
3141338,1099769,20,125,Grüne,omid,nouripour,2023-09-28,Economy,"Diese Zuversicht sieht man zum Beispiel, wenn eine Krankenschwester nicht einen halben Tag Formulare ausfüllen muss, sondern deutlich mehr Zeit hat für das Zwischenmenschliche, was ja nicht nur in den Pflegeberufen zentral ist. In zehn Jahren werden so ziemlich alle Arbeitsplätze in diesem Land mit KI arbeiten.",zuversicht sieht beispiel krankenschwester halben tag formulare ausfüllen deutlich mehr zeit zwischenmenschliche pflegeberufen zentral zehn jahren ziemlich arbeitsplätze land ki arbeiten,positive,neutral
3141346,1099769,20,125,Grüne,omid,nouripour,2023-09-28,Economy,"Und es ist nicht nur die Start-up-Strategie, die dieser Tage zeigt, dass wir vieles nachholen, was die Union nicht gemacht hat. Das ist natürlich auch der Aktionsplan KI.",startupstrategie tage zeigt vieles nachholen union gemacht aktionsplan ki,neutral,negative
3141351,1099769,20,125,Grüne,omid,nouripour,2023-09-28,Society,"Aber es reicht nicht, nur Potenziale zu benennen, und es reicht nicht, nur zu regulieren, wir müssen auch die großen Diskussionen führen, und zwar gesamtgesellschaftlich. Wir müssen die Diskussion führen über die Zukunftsfragen, und wir sollten nicht nur darüber reden, wo man KI anwendet, sondern vor allem darüber, wo man KI nicht anwendet und wo der Raum ist, in dem Menschlichkeit, das Menschsein unangetastet bleiben muss, unabhängig davon, wie der technologische Fortschritt ist.",reicht potenziale benennen reicht regulieren müssen großen diskussionen führen gesamtgesellschaftlich müssen diskussion führen zukunftsfragen sollten darüber reden ki anwendet darüber ki anwendet raum menschlichkeit menschsein unangetastet bleiben unabhängig davon technologische fortschritt,positive,negative
3141358,1099771,20,125,Linke,petra,sitte,2023-09-28,Policy,"Meine Damen und Herren! Um erst einmal allen Fehlschlüssen vorzubeugen, sage ich vorab: Künstliche Intelligenz und Quantencomputing können enorme Vorteile bringen.",,positive,positive
3141363,1099771,20,125,Linke,petra,sitte,2023-09-28,Policy,"Wenn aber, wie in Ihrem Antrag gefordert, der Staat als „Ankerkunde“ einen Markt erst schaffen und die Risiken einseitig tragen soll, dann geht das deutlich zu weit. Sie wollen mit Ihrem Antrag schnell und viel öffentliche Mittel in KI investieren.",gefordert staat „ankerkunde“ markt schaffen risiken einseitig tragen geht deutlich weit schnell öffentliche mittel ki investieren,neutral,neutral
3141365,1099771,20,125,Linke,petra,sitte,2023-09-28,Society,"Vernachlässigt wird dabei eine sinnvolle Balance zwischen tatsächlichen Chancen und Risiken dieser Technologie. Wir wissen bereits über künstliche Intelligenz, dass sie auch erhebliche Probleme für die Gesellschaft, für Menschen und natürlich auch für die Natur hervorbringen kann.",vernachlässigt sinnvolle balance tatsächlichen chancen risiken technologie wissen bereits künstliche intelligenz erhebliche probleme gesellschaft menschen natur hervorbringen,negative,neutral
3141366,1099771,20,125,Linke,petra,sitte,2023-09-28,Society,"Wir wissen bereits über künstliche Intelligenz, dass sie auch erhebliche Probleme für die Gesellschaft, für Menschen und natürlich auch für die Natur hervorbringen kann. KI kann Menschen diskriminieren, Fake News verstärken, sie verbraucht Unmengen von Ressourcen und die Arbeitsbedingungen im Globalen Süden für das Training von KI sind nach wie vor ausbeuterisch.",wissen bereits künstliche intelligenz erhebliche probleme gesellschaft menschen natur hervorbringen ki menschen diskriminieren fake news verstärken verbraucht unmengen ressourcen arbeitsbedingungen globalen süden training ki ausbeuterisch,negative,neutral
3141367,1099771,20,125,Linke,petra,sitte,2023-09-28,Society,"KI kann Menschen diskriminieren, Fake News verstärken, sie verbraucht Unmengen von Ressourcen und die Arbeitsbedingungen im Globalen Süden für das Training von KI sind nach wie vor ausbeuterisch. Zugleich – um auch dieses mit zu erwähnen – werden die Urheberinnen und Urheber, also die Kreativen, für ihre Leistungen, die von der KI verarbeitet werden, nicht vergütet.",ki menschen diskriminieren fake news verstärken verbraucht unmengen ressourcen arbeitsbedingungen globalen süden training ki ausbeuterisch zugleich – erwähnen – urheberinnen urheber kreativen leistungen ki verarbeitet vergütet,negative,neutral
3141368,1099771,20,125,Linke,petra,sitte,2023-09-28,Economy,"Zugleich – um auch dieses mit zu erwähnen – werden die Urheberinnen und Urheber, also die Kreativen, für ihre Leistungen, die von der KI verarbeitet werden, nicht vergütet. Schließlich verändert KI zunehmend menschliche Arbeitsleistung oder sorgt dafür, dass sie nicht mehr gebraucht wird, was viele Beschäftigte – wir haben das ja gerade auch beim Streik in den USA gesehen – zutiefst beunruhigt.",zugleich – erwähnen – urheberinnen urheber kreativen leistungen ki verarbeitet vergütet schließlich verändert ki zunehmend menschliche arbeitsleistung sorgt mehr gebraucht viele beschäftigte – beim streik usa gesehen – zutiefst beunruhigt,negative,neutral
3141370,1099771,20,125,Linke,petra,sitte,2023-09-28,Science,"Sie erwarten selbstverständlich, dass ihre Sorgen berücksichtigt werden, dass verlässliche Perspektiven aufgezeigt werden, auch im Rahmen von Sozialpartnerschaften. Wir meinen, KI braucht vor allem Fairness, Transparenz und mehr Investitionen in Forschung und Bildung.",erwarten selbstverständlich sorgen berücksichtigt verlässliche perspektiven aufgezeigt rahmen sozialpartnerschaften ki braucht fairness transparenz mehr investitionen forschung bildung,negative,neutral
3141386,1099775,20,125,FDP,maximilian,funke-kaiser,2023-09-28,Economy,Liebe Kolleginnen und Kollegen! Künstliche Intelligenz ist eine Jahrtausendtechnologie.,kolleginnen kollegen künstliche intelligenz jahrtausendtechnologie,positive,neutral
3141392,1099775,20,125,FDP,maximilian,funke-kaiser,2023-09-28,Economy,"Ganze Geschäftsmodelle werden neu entstehen. Es wurde gerade schon angesprochen, und es ist wichtig, dass das noch einmal beziffert wird: Die Wertschöpfung, das Bruttoinlandsprodukt in Deutschland, kann um 330 Milliarden Euro gesteigert werden, wenn nur die Hälfte der Unternehmen KI nutzen.",ganze geschäftsmodelle neu entstehen wurde angesprochen wichtig beziffert wertschöpfung bruttoinlandsprodukt deutschland milliarden euro gesteigert hälfte unternehmen ki nutzen,positive,neutral
3141401,1099775,20,125,FDP,maximilian,funke-kaiser,2023-09-28,Policy,"Ich finde, es spricht übrigens Bände, dass dieser Punkt in Ihrem Antrag noch nicht einmal in einem Nebensatz erwähnt wird, liebe Union. Zum klugen Umgang mit KI gehört auch, dass wir die Rahmenbedingungen verbessern und endlich aufhören, uns selber immer schlechter zu reden, als wir sind; denn wir haben bereits heute eine wahnsinnig gute KI-Forschungslandschaft.",finde spricht bände punkt nebensatz erwähnt union klugen umgang ki gehört rahmenbedingungen verbessern endlich aufhören selber immer schlechter reden bereits heute wahnsinnig gute kiforschungslandschaft,neutral,positive
3141421,1099775,20,125,FDP,maximilian,funke-kaiser,2023-09-28,Policy,"Vielleicht sollten wir das auch noch einmal in den Kontext setzen zu dem, was Sie in Ihrem Antrag geschrieben haben. Sie reden von fünf Jahren KI-Strategie.",sollten kontext setzen geschrieben reden fünf jahren kistrategie,neutral,neutral
3141422,1099775,20,125,FDP,maximilian,funke-kaiser,2023-09-28,Policy,"Sie reden von fünf Jahren KI-Strategie. Ihre Ministerin hat in dem Jahr, in dem diese KI-Strategie geschrieben worden ist, 20 Millionen Euro für KI ausgegeben.",reden fünf jahren kistrategie ministerin jahr kistrategie geschrieben worden millionen euro ki ausgegeben,neutral,neutral
3141430,1099775,20,125,FDP,maximilian,funke-kaiser,2023-09-28,Policy,Sie reiten überwiegend auf dem Haushalt herum; mehr haben Sie nicht. Ich darf Sie noch einmal final aufklären: Wir investieren mehr Mittel in künstliche Intelligenz als jede Vorgängerregierung zuvor.,reiten überwiegend haushalt herum mehr darf final aufklären investieren mehr mittel künstliche intelligenz vorgängerregierung zuvor,neutral,neutral
3141432,1099775,20,125,FDP,maximilian,funke-kaiser,2023-09-28,Policy,"Was wir hier vorlegen, das ist kein Sparhaushalt; es ist ein Prioritätenhaushalt. Das BMWF priorisiert ganz klar pro KI, liebe Kolleginnen und Kollegen.",vorlegen sparhaushalt prioritätenhaushalt bmwf priorisiert ganz pro ki kolleginnen kollegen,neutral,neutral
3141435,1099775,20,125,FDP,maximilian,funke-kaiser,2023-09-28,Science,Wir brauchen europäische KI-Modelle. Deswegen bauen wir die KI-Rechenzentrumsinfrastruktur hier in Deutschland aus; denn diese KI-Modelle sind das wirklich Innovative bei generativer KI.,brauchen europäische kimodelle bauen kirechenzentrumsinfrastruktur deutschland kimodelle innovative generativer ki,neutral,neutral
3141438,1099775,20,125,FDP,maximilian,funke-kaiser,2023-09-28,Economy,"Zudem fördern wir gezielt die Integration von KI-Anwendungen in den Arbeitsmarkt, in deutschen Unternehmen, in Industrie 4.0, in der Robotik, wo sich im Übrigen auch meine Heimat Augsburg gerade zu einem regelrechten Hub entwickelt. Mit KI-Ausgründungen, mit über 100 Professuren im Bereich KI und dem Fachkräfteeinwanderungsgesetz haben wir beste Voraussetzungen geschaffen.",zudem fördern gezielt integration kianwendungen arbeitsmarkt deutschen unternehmen industrie robotik übrigen heimat augsburg regelrechten hub entwickelt kiausgründungen professuren bereich ki fachkräfteeinwanderungsgesetz beste voraussetzungen geschaffen,neutral,neutral
3141446,1099777,20,125,CDU/CSU,nadine,schön,2023-09-28,Policy,"Erst einmal ein herzliches Dankeschön für die lebendige Debatte, die wir mit unserem Antrag offensichtlich ausgelöst haben. Denn – darüber sind wir uns ja einig – künstliche Intelligenz ist eben ein ganz wichtiges Thema.",herzliches dankeschön lebendige debatte offensichtlich ausgelöst – darüber – künstliche intelligenz ganz wichtiges thema,neutral,neutral
3141465,1099777,20,125,CDU/CSU,nadine,schön,2023-09-28,Policy,"Dafür gibt es zwei Begründungen: Entweder konnten Sie sich wieder zwischen den Häusern nicht einigen – das ist nämlich öfter im Digitalbereich der Fall –, oder es ist Ihnen nicht so wichtig. Aber vorzupreschen mit dem Aktionsplan, statt die KI-Strategie fortzuschreiben, ist jetzt nach zwei Jahren nicht wahnsinnig ambitioniert.",gibt zwei begründungen entweder konnten häusern – öfter digitalbereich fall – wichtig vorzupreschen aktionsplan statt kistrategie fortzuschreiben zwei jahren wahnsinnig ambitioniert,neutral,negative
3141473,1099777,20,125,CDU/CSU,nadine,schön,2023-09-28,Policy,"Deshalb verlange ich von Ihnen, dass Sie hier Transparenz schaffen. Sie können nicht verschweigen, dass wir in unserer Regierungszeit 3 Milliarden Euro für künstliche Intelligenz eingestellt haben.",verlange transparenz schaffen verschweigen unserer regierungszeit milliarden euro künstliche intelligenz eingestellt,neutral,neutral
3141475,1099777,20,125,CDU/CSU,nadine,schön,2023-09-28,Science,Wir haben 100 KI-Professuren auf den Weg gebracht. Wir haben die erste KI-Strategie auf den Weg gebracht.,kiprofessuren gebracht erste kistrategie gebracht,neutral,neutral
3141480,1099777,20,125,CDU/CSU,nadine,schön,2023-09-28,Economy,"Deshalb: Ein bisschen mehr Redlichkeit bei dem Thema würde Ihnen schon gut zu Gesicht stehen. Wir legen hier neun konkrete Punkte vor, was Sie machen müssen, um KI in unserem Land voranzubringen.",bisschen mehr redlichkeit thema gesicht stehen legen neun konkrete punkte müssen ki land voranzubringen,neutral,positive
3141513,1099781,20,125,SPD,holger,mann,2023-09-28,Policy,"Es wäre schon gut, wenn man ab und zu im Ausschuss ist, Frau Schön. Wenn man die Bundesregierung nach Zahlen fragt und die Bundesregierung Ihnen antwortet, dass in den letzten drei Jahren die Mittel für KI von 280 Millionen Euro auf im laufenden Jahr 427 Millionen Euro und dann im Haushaltsentwurf an über 20 Positionen auf insgesamt fast 500 Millionen Euro steigen, dann kann man sich doch hier nicht hinstellen und davon sprechen, dass sie gekürzt würden.",wäre ab ausschuss bundesregierung zahlen fragt bundesregierung antwortet letzten drei jahren mittel ki millionen euro laufenden jahr millionen euro haushaltsentwurf positionen insgesamt millionen euro steigen hinstellen davon sprechen gekürzt,neutral,negative
3141518,1099781,20,125,SPD,holger,mann,2023-09-28,Science,"Wir wollen weitere 150 KI-Professuren. Ja, auch das BMWF geht voran und wird Ankerkunde im Bereich KI, und wir bauen das Förderökosystem aus.",weitere kiprofessuren bmwf geht voran ankerkunde bereich ki bauen förderökosystem,neutral,neutral
3141527,1099783,20,125,Grüne,kai,gehring,2023-09-28,Society,"Als Ausschuss für Bildung, Forschung und Technikfolgenabschätzung haben wir im Frühjahr Pionierarbeit geleistet mit einem Gutachten über ChatGPT und einer Sachverständigenanhörung dazu. Schon in der letzten Wahlperiode haben wir uns als Bundestag in der Enquete-Kommission „Künstliche Intelligenz“ mit gesellschaftlicher Verantwortung sowie wirtschaftlichen, sozialen und ökologischen Potenzialen von KI auseinandergesetzt und weiterführende Forschungsfragen adressiert.",ausschuss bildung forschung technikfolgenabschätzung frühjahr pionierarbeit geleistet gutachten chatgpt sachverständigenanhörung letzten wahlperiode bundestag enquetekommission „künstliche intelligenz“ gesellschaftlicher verantwortung sowie wirtschaftlichen sozialen ökologischen potenzialen ki auseinandergesetzt weiterführende forschungsfragen adressiert,neutral,neutral
3141528,1099783,20,125,Grüne,kai,gehring,2023-09-28,Society,"Schon in der letzten Wahlperiode haben wir uns als Bundestag in der Enquete-Kommission „Künstliche Intelligenz“ mit gesellschaftlicher Verantwortung sowie wirtschaftlichen, sozialen und ökologischen Potenzialen von KI auseinandergesetzt und weiterführende Forschungsfragen adressiert. KI ist ein Innovationstreiber und ein Paradebeispiel für Technikfolgenabschätzung.",letzten wahlperiode bundestag enquetekommission „künstliche intelligenz“ gesellschaftlicher verantwortung sowie wirtschaftlichen sozialen ökologischen potenzialen ki auseinandergesetzt weiterführende forschungsfragen adressiert ki innovationstreiber paradebeispiel technikfolgenabschätzung,positive,neutral
3141529,1099783,20,125,Grüne,kai,gehring,2023-09-28,Society,"KI ist ein Innovationstreiber und ein Paradebeispiel für Technikfolgenabschätzung. Denn unsere Aufgabe ist, die Chancen von KI zu heben und die Risiken einzuhegen: Was ist möglich?",ki innovationstreiber paradebeispiel technikfolgenabschätzung aufgabe chancen ki heben risiken einzuhegen möglich,positive,neutral
3141533,1099783,20,125,Grüne,kai,gehring,2023-09-28,Society,"Das geht uns alle an. KI kann Diagnostik in der Medizin verbessern, Dekarbonisierung beschleunigen und Klimadaten präzisieren.",geht ki diagnostik medizin verbessern dekarbonisierung beschleunigen klimadaten präzisieren,positive,neutral
3141536,1099783,20,125,Grüne,kai,gehring,2023-09-28,Society,"Zugleich können Chatroboter Menschen manipulieren und Falschinformationen verbreiten. Wenn man bei Deepfakes den eigenen Augen und Ohren nicht mehr trauen kann, dann droht KI, Wahrheit zu demontieren.",zugleich chatroboter menschen manipulieren falschinformationen verbreiten deepfakes eigenen augen ohren mehr trauen droht ki wahrheit demontieren,negative,neutral
3141538,1099783,20,125,Grüne,kai,gehring,2023-09-28,Society,"Wie lässt sich KI-Modellen Ethik und ein Wertegerüst beibringen? Vor KI brauchen wir uns nicht zu fürchten, nur vor Menschen, die diese Technik missbrauchen.",lässt kimodellen ethik wertegerüst beibringen ki brauchen fürchten menschen technik missbrauchen,negative,neutral
3141541,1099783,20,125,Grüne,kai,gehring,2023-09-28,Policy,"Und ich bin sicher: Der neue KI-Aktionsplan wird richtungsweisend sein. Das muss er auch; denn die KI-Strategie der Vorgängerregierung aus dem Jahr 2018 braucht dringend ein Update, weil dieses Feld so dynamisch ist.",sicher neue kiaktionsplan richtungsweisend kistrategie vorgängerregierung jahr braucht dringend update feld dynamisch,neutral,negative
3141545,1099783,20,125,Grüne,kai,gehring,2023-09-28,Society,So entwickeln wir das Feld kraftvoll nach vorne. Zugleich haben Algorithmen kein Gewissen und keine Empathie.,entwickeln feld kraftvoll vorne zugleich algorithmen gewissen empathie,negative,neutral
3141547,1099783,20,125,Grüne,kai,gehring,2023-09-28,Society,"Unsere Haltung bei KI-Systemen muss sein, Neutralität und Transparenz sicherzustellen. KI muss mit unseren Menschen-, Grund- und Freiheitsrechten im Einklang stehen.",haltung kisystemen neutralität transparenz sicherzustellen ki menschen grund freiheitsrechten einklang stehen,neutral,neutral
3141548,1099783,20,125,Grüne,kai,gehring,2023-09-28,Science,"KI muss mit unseren Menschen-, Grund- und Freiheitsrechten im Einklang stehen. KI ist längst in allen Bildungseinrichtungen angekommen.",ki menschen grund freiheitsrechten einklang stehen ki längst bildungseinrichtungen angekommen,neutral,neutral
3141549,1099783,20,125,Grüne,kai,gehring,2023-09-28,Science,KI ist längst in allen Bildungseinrichtungen angekommen. Im Unterricht muss verantwortungsbewusster mit KI umgegangen werden.,ki längst bildungseinrichtungen angekommen unterricht verantwortungsbewusster ki umgegangen,neutral,neutral
3141552,1099783,20,125,Grüne,kai,gehring,2023-09-28,Science,"Wichtig wird sein, allen Jugendlichen die gleichen Zugänge zu KI-Programmen zu ermöglichen und niemanden digital abzuhängen. Dafür müssen wir auch unsere Lehrkräfte zügig im Umgang mit KI aus- und weiterbilden.",wichtig jugendlichen gleichen zugänge kiprogrammen ermöglichen niemanden digital abzuhängen müssen lehrkräfte zügig umgang ki weiterbilden,neutral,neutral
3141553,1099783,20,125,Grüne,kai,gehring,2023-09-28,Society,Dafür müssen wir auch unsere Lehrkräfte zügig im Umgang mit KI aus- und weiterbilden. Dann kann KI auch zu mehr Chancengerechtigkeit führen.,müssen lehrkräfte zügig umgang ki weiterbilden ki mehr chancengerechtigkeit führen,neutral,neutral
3141554,1099783,20,125,Grüne,kai,gehring,2023-09-28,Society,"Dann kann KI auch zu mehr Chancengerechtigkeit führen. Leisten wir hier also weiter Pionierarbeit, damit KI unserer demokratischen Gesellschaft nutzt, anstatt ihr zu schaden.",ki mehr chancengerechtigkeit führen leisten pionierarbeit ki unserer demokratischen gesellschaft nutzt anstatt schaden,neutral,neutral
3141557,1099785,20,125,CDU/CSU,katrin,staffler,2023-09-28,Science,"Liebe Kolleginnen und Kollegen! Wenn man sich die Entwicklung der KI seit den 50er-Jahren, also in den letzten 70 Jahren, anschaut, wird offensichtlich, wie rasant sich das Wissen und die Möglichkeiten auf diesem Feld gerade in den letzten 10, 15 Jahren weiterentwickelt haben.",kolleginnen kollegen entwicklung ki seit erjahren letzten jahren anschaut offensichtlich rasant wissen möglichkeiten feld letzten jahren weiterentwickelt,neutral,negative
3141560,1099785,20,125,CDU/CSU,katrin,staffler,2023-09-28,Policy,"Und angesichts der Geschwindigkeit, in der sich die Dinge verändern, können wir als politisch Verantwortliche aus meiner Sicht nicht Monat für Monat ins Land ziehen lassen und die Hände in den Schoß legen und nichts tun. Die KI-Strategie der Vorgängerregierung wird im November fünf Jahre alt.",angesichts geschwindigkeit dinge verändern politisch verantwortliche sicht monat monat land ziehen lassen hände schoß legen tun kistrategie vorgängerregierung november fünf jahre alt,neutral,neutral
3141567,1099785,20,125,CDU/CSU,katrin,staffler,2023-09-28,Policy,"Und um eines an dieser Stelle auch ganz deutlich zu sagen: Ein Aktionsplan an sich hilft uns nicht weiter, solange wir immer nur über Regulatorik reden, wie in der einen oder anderen Rede heute hier, und solange wir noch überhaupt nicht wissen, wie die einzelnen Umsetzungsschritte finanziert werden sollen. Die Antwort auf die Frage, wie die Finanzierung konkret ausschauen soll, liebe Kolleginnen und Kollegen, sind Sie auch heute wieder schuldig geblieben, im Übrigen genauso wie Staatssekretär Jens Brandenburg gestern im Digitalausschuss, der auch nicht mehr so genau gewusst hat, wo im Einzelnen sich diese neuen Projekte zum Thema KI im Haushalt eigentlich verstecken.",stelle ganz deutlich sagen aktionsplan hilft solange immer regulatorik reden heute solange überhaupt wissen einzelnen umsetzungsschritte finanziert sollen frage finanzierung konkret ausschauen kolleginnen kollegen heute schuldig geblieben übrigen genauso staatssekretär jens brandenburg gestern digitalausschuss mehr gewusst einzelnen neuen projekte thema ki haushalt verstecken,neutral,negative
3141573,1099785,20,125,CDU/CSU,katrin,staffler,2023-09-28,Science,"Die baiosphere, also das Bavarian IA Network, verbindet landesweit Hunderte Akteure aus Wissenschaft, Forschung und Anwendung. Wir haben hundert zusätzliche Professuren im Bereich KI geschaffen.",baiosphere bavarian ia network verbindet landesweit hunderte akteure wissenschaft forschung anwendung hundert zusätzliche professuren bereich ki geschaffen,neutral,neutral
3141574,1099785,20,125,CDU/CSU,katrin,staffler,2023-09-28,Science,"Wir haben hundert zusätzliche Professuren im Bereich KI geschaffen. Das Munich Data Science Institute am Garchinger Campus ist das Zentrum für künstliche Intelligenz, an dem Forscherinnen und Forscher aus unterschiedlichen Fachrichtungen zum Thema KI gemeinsam forschen.",hundert zusätzliche professuren bereich ki geschaffen munich data science institute garchinger campus zentrum künstliche intelligenz forscherinnen forscher unterschiedlichen fachrichtungen thema ki gemeinsam forschen,neutral,neutral
3141578,1099785,20,125,CDU/CSU,katrin,staffler,2023-09-28,Policy,"Und genau das fordern wir in unserem Antrag. Schauen Sie sich unsere Vorschläge an, und fangen Sie an, die Aktivitätsschraube im Bereich KI endlich deutlich anzuziehen.",fordern schauen vorschläge fangen aktivitätsschraube bereich ki endlich deutlich anzuziehen,neutral,neutral
